{"advertised_item_coverage":[],"arguments":["job/document-package.json","-o","$OUTPUT/output.pdf","--package-root","job/root","--profile","typaxis.machine-pdf/paragraph-1","--resource-root","job","--emit-build-manifest","$OUTPUT/manifest.json","--emit-diagnostics","$OUTPUT/diagnostics.json"],"command":"build-package","contract":"typaxis.contract/1.1","expected":{"exit_code":2,"location":null,"manifest_progress":{"package":"none","resources":"none","sources":"none"},"normalized_extracted_text":null,"page_count":null,"primary_code":null,"side_effects":{"layout_started":false,"package_read":false,"pdf_started":false,"resource_opened":false,"source_read":false},"visible_artifacts":[]},"fixture_class":"negative","fixture_id":"usage.package-outside-root","package":"job/document-package.json","profile":"typaxis.machine-pdf/paragraph-1","resource_hashes":[]}