{"advertised_item_coverage":["block:heading","block:paragraph","font_format:sfnt-truetype-glyf","font_format:ttc-truetype-glyf","inline:anchor","inline:hard_break","inline:reference","inline:soft_break","inline:text","page_master:default","page_value:auto","pdf_feature:named-destinations","pdf_feature:text-extraction","reference_format:page","source_closure:entry_only","style_block_type:heading","style_block_type:paragraph","style_property:font_family","style_property:font_size","style_property:line_height","style_property:page","style_selector:heading","style_selector:paragraph"],"arguments":["job/document-package.json","-o","$OUTPUT/output.pdf","--package-root","job","--profile","typaxis.machine-pdf/paragraph-1","--resource-root","job","--emit-build-manifest","$OUTPUT/manifest.json","--emit-diagnostics","$OUTPUT/diagnostics.json"],"command":"build-package","contract":"typaxis.contract/1.1","expected":{"exit_code":0,"location":null,"manifest_progress":{"package":"validated","resources":"admitted","sources":"admitted"},"normalized_extracted_text":"Typaxis machine input","page_count":1,"primary_code":null,"side_effects":{"layout_started":true,"package_read":true,"pdf_started":true,"resource_opened":true,"source_read":true},"visible_artifacts":["diagnostics","manifest","pdf"]},"fixture_class":"positive","fixture_id":"paragraph-1.combined","package":"job/document-package.json","profile":"typaxis.machine-pdf/paragraph-1","resource_hashes":[{"bytes":1180,"sha256":"c399cf1de56ffdc143b97547749a128b49b9356ec89a07a86ab0ca8107b3c50e","uri":"fonts/body.ttf"},{"bytes":1196,"sha256":"3a5f1d1bcbda54c4fa3543f0b886d6fa86cec51ed0328a22e10874426112259c","uri":"fonts/collection.ttc"}]}