{"advertised_item_coverage":["block:table","style_block_type:table","style_selector:table"],"arguments":["job/document-package.json","-o","$OUTPUT/output.pdf","--package-root","job","--profile","typaxis.machine-pdf/table-1","--resource-root","job","--trace","$OUTPUT/trace.json","--trace-text","--emit-build-manifest","$OUTPUT/manifest.json","--emit-diagnostics","$OUTPUT/diagnostics.json"],"command":"build-package","contract":"typaxis.contract/1.2","expected":{"exit_code":0,"location":null,"manifest_progress":{"package":"validated","resources":"admitted","sources":"admitted"},"normalized_extracted_text":"Header A alpha Header B beta gamma","page_count":1,"primary_code":null,"side_effects":{"layout_started":true,"package_read":true,"pdf_started":true,"resource_opened":true,"source_read":true},"visible_artifacts":["diagnostics","manifest","pdf","trace"]},"fixture_class":"positive","fixture_id":"table-1.only","package":"job/document-package.json","profile":"typaxis.machine-pdf/table-1","resource_hashes":[{"bytes":1180,"sha256":"c399cf1de56ffdc143b97547749a128b49b9356ec89a07a86ab0ca8107b3c50e","uri":"body.ttf"}]}