{"advertised_item_coverage":[],"arguments":["job/document-package.json","-o","$OUTPUT/output.pdf","--package-root","job","--profile","typaxis.machine-pdf/paragraph-1","--resource-root","job","--emit-build-manifest","$OUTPUT/manifest.json","--emit-diagnostics","$OUTPUT/diagnostics.json"],"command":"build-package","contract":"typaxis.contract/1.1","expected":{"exit_code":3,"location":"global","manifest_progress":{"package":"decoded","resources":"none","sources":"none"},"normalized_extracted_text":null,"page_count":null,"primary_code":"I9113","side_effects":{"layout_started":false,"package_read":true,"pdf_started":false,"resource_opened":false,"source_read":true},"visible_artifacts":["diagnostics","manifest"]},"fixture_class":"tamper","fixture_id":"i9113.source-mutation","package":"job/document-package.json","profile":"typaxis.machine-pdf/paragraph-1","resource_hashes":[]}