{"advertised_item_coverage":["page_master:default","source_closure:entry_only"],"arguments":["job/document-package.json","-o","$OUTPUT/output.pdf","--package-root","job","--profile","typaxis.machine-pdf/paragraph-1","--resource-root","job","--emit-build-manifest","$OUTPUT/manifest.json","--emit-diagnostics","$OUTPUT/diagnostics.json"],"command":"build-package","contract":"typaxis.contract/1.2","expected":{"exit_code":0,"location":null,"manifest_progress":{"package":"validated","resources":"admitted","sources":"admitted"},"normalized_extracted_text":"","page_count":1,"primary_code":null,"side_effects":{"layout_started":true,"package_read":true,"pdf_started":true,"resource_opened":false,"source_read":true},"visible_artifacts":["diagnostics","manifest","pdf"]},"fixture_class":"positive","fixture_id":"paragraph-1.blank-1.2","package":"job/document-package.json","profile":"typaxis.machine-pdf/paragraph-1","resource_hashes":[]}