{"advertised_item_coverage":[],"arguments":["job/document-package.json","-o","$OUTPUT/output.pdf","--package-root","job","--profile","typaxis.machine-pdf/paragraph-1","--resource-root","job","--emit-build-manifest","$OUTPUT/manifest.json","--emit-diagnostics","$OUTPUT/diagnostics.json"],"command":"build-package","contract":"typaxis.contract/1.1","expected":{"exit_code":1,"location":"json:/document/blocks/0","manifest_progress":{"package":"validated","resources":"registered","sources":"admitted"},"normalized_extracted_text":null,"page_count":null,"primary_code":"L5100","side_effects":{"layout_started":false,"package_read":true,"pdf_started":false,"resource_opened":false,"source_read":true},"visible_artifacts":["diagnostics","manifest"]},"fixture_class":"limit","fixture_id":"diagnostics.max-plus-one","package":"job/document-package.json","profile":"typaxis.machine-pdf/paragraph-1","resource_hashes":[]}