{"advertised_item_coverage":["page_master:default","source_closure:entry_only"],"arguments":["job/document-package.json","-o","$OUTPUT/output.pdf","--package-root","job","--profile","typaxis.machine-pdf/footnote-1","--resource-root","job","--trace","$OUTPUT/trace.json","--trace-text","--emit-build-manifest","$OUTPUT/manifest.json","--emit-diagnostics","$OUTPUT/diagnostics.json"],"command":"build-package","contract":"typaxis.contract/1.2","expected":{"exit_code":0,"location":null,"manifest_progress":{"package":"validated","resources":"admitted","sources":"admitted"},"normalized_extracted_text":"Basic document internal external First item Second entry PNG caption","page_count":2,"primary_code":null,"side_effects":{"layout_started":true,"package_read":true,"pdf_started":true,"resource_opened":true,"source_read":true},"visible_artifacts":["diagnostics","manifest","pdf","trace"]},"fixture_class":"positive","fixture_id":"footnote-1.zero","package":"job/document-package.json","profile":"typaxis.machine-pdf/footnote-1","resource_hashes":[{"bytes":1180,"sha256":"c399cf1de56ffdc143b97547749a128b49b9356ec89a07a86ab0ca8107b3c50e","uri":"body.ttf"},{"bytes":1196,"sha256":"3a5f1d1bcbda54c4fa3543f0b886d6fa86cec51ed0328a22e10874426112259c","uri":"collection.ttc"},{"bytes":99,"sha256":"d258ded2ba32f918e46abed09cf3e9f14d274355a65c92fd0a948a4340e24d74","uri":"figure.data"}]}